{
    "$schema": "../json/sup.json",
    "version": 0.4,
    "env": {
        "SUP_USER": "root"
    },
    "networks": {
        "local": {
            "hosts": [
                "127.0.0.1"
            ]
        },
        "test": {
            "hosts": [
                "10.0.52.1"
            ]
        },
        "intgr": {
            "hosts": [
                "10.0.50.166",
                "10.0.50.167"
            ]
        }
    },
    "commands": {
        "showTime":{
            "desc": "show current time of host",
            "run": "date"
        },
        "ping":{
            "local": "ping 10.0.50.166"
        }
    }
    
}